{
  "$schema": "./api.schema.json",
  "apiVersion": 1,
  "casing": {
    "node": "camel",
    "react": "camel",
    "python": "snake",
    "swift": "camel",
    "kotlin": "camel",
    "godot": "snake"
  },
  "surfaces": {
    "node": [
      {
        "ns": "client",
        "type": "PolarisKeyClient",
        "file": "packages/sdk-node/src/client.ts"
      },
      {
        "ns": "config",
        "type": "ConfigClient",
        "file": "packages/sdk-node/src/config/client.ts"
      },
      {
        "ns": "config",
        "type": "ConfigSetting",
        "file": "packages/sdk-node/src/config/client.ts"
      },
      {
        "ns": "license",
        "type": "LicenseClient",
        "file": "packages/sdk-node/src/license/client.ts"
      },
      {
        "ns": "entitlements",
        "type": "EntitlementsClient",
        "file": "packages/sdk-node/src/license/entitlements.ts"
      },
      {
        "ns": "identity",
        "type": "IdentityClient",
        "file": "packages/sdk-node/src/identity/client.ts"
      },
      {
        "ns": "devices",
        "type": "DevicesClient",
        "file": "packages/sdk-node/src/devices/client.ts"
      },
      {
        "ns": "release",
        "type": "ReleaseClient",
        "file": "packages/sdk-node/src/release/client.ts"
      },
      {
        "ns": "update",
        "type": "UpdateClient",
        "file": "packages/sdk-node/src/update/client.ts"
      },
      {
        "ns": "distribution",
        "type": "DistributionClient",
        "file": "packages/sdk-node/src/distribution/client.ts"
      },
      {
        "ns": "commerce",
        "type": "CommerceClient",
        "file": "packages/sdk-node/src/commerce/client.ts"
      },
      {
        "ns": "packs",
        "type": "PacksClient",
        "file": "packages/sdk-node/src/packs/client.ts"
      },
      {
        "ns": "events",
        "type": "PolarisEventEmitter",
        "file": "packages/sdk-node/src/core/events.ts"
      },
      {
        "ns": "store",
        "type": "Store",
        "file": "packages/sdk-node/src/core/store.ts"
      },
      {
        "ns": "presentation",
        "type": "PresentationStore",
        "file": "packages/sdk-node/src/core/presentation.ts"
      },
      {
        "ns": "boot",
        "file": "packages/sdk-node/src/boot.ts"
      }
    ],
    "react": [
      {
        "ns": "client",
        "file": "packages/sdk-react/src/react/hooks.ts"
      },
      {
        "ns": "client",
        "file": "packages/sdk-react/src/react/Provider.tsx"
      },
      {
        "ns": "options",
        "type": "PolarisKeyConfig",
        "file": "packages/sdk-react/src/react/Provider.tsx"
      },
      {
        "ns": "client",
        "file": "packages/sdk-react/src/react/useBoot.ts"
      },
      {
        "ns": "client",
        "file": "packages/sdk-react/src/react/usePresentation.ts"
      },
      {
        "ns": "client",
        "file": "packages/sdk-react/src/react/usePolarisFetch.ts"
      },
      {
        "ns": "update",
        "file": "packages/sdk-react/src/update/useLatestVersion.ts"
      },
      {
        "ns": "update",
        "file": "packages/sdk-react/src/update/useUpdateDecision.ts"
      },
      {
        "ns": "release",
        "file": "packages/sdk-react/src/release/useChangelog.ts"
      }
    ],
    "python": [
      {
        "ns": "client",
        "type": "PolarisKeyClient",
        "file": "sdks/python/src/polaris_key/client.py"
      },
      {
        "ns": "client",
        "type": "AsyncPolarisKeyClient",
        "file": "sdks/python/src/polaris_key/aio.py"
      },
      {
        "ns": "client",
        "file": "sdks/python/src/polaris_key/server_client.py"
      },
      {
        "ns": "config",
        "type": "ConfigClient",
        "file": "sdks/python/src/polaris_key/config/client.py"
      },
      {
        "ns": "config",
        "type": "ConfigSetting",
        "file": "sdks/python/src/polaris_key/config/client.py"
      },
      {
        "ns": "license",
        "type": "LicenseClient",
        "file": "sdks/python/src/polaris_key/license/client.py"
      },
      {
        "ns": "entitlements",
        "type": "EntitlementsClient",
        "file": "sdks/python/src/polaris_key/license/entitlements.py"
      },
      {
        "ns": "identity",
        "type": "IdentityClient",
        "file": "sdks/python/src/polaris_key/identity/client.py"
      },
      {
        "ns": "devices",
        "type": "DevicesClient",
        "file": "sdks/python/src/polaris_key/devices/client.py"
      },
      {
        "ns": "release",
        "type": "ReleaseClient",
        "file": "sdks/python/src/polaris_key/release/client.py"
      },
      {
        "ns": "update",
        "type": "UpdateClient",
        "file": "sdks/python/src/polaris_key/update/client.py"
      },
      {
        "ns": "distribution",
        "type": "DistributionClient",
        "file": "sdks/python/src/polaris_key/distribution/__init__.py"
      },
      {
        "ns": "commerce",
        "type": "CommerceClient",
        "file": "sdks/python/src/polaris_key/commerce/__init__.py"
      },
      {
        "ns": "packs",
        "type": "PacksClient",
        "file": "sdks/python/src/polaris_key/update/packs/client.py"
      },
      {
        "ns": "events",
        "type": "EventBus",
        "file": "sdks/python/src/polaris_key/core/events.py"
      },
      {
        "ns": "store",
        "type": "Store",
        "file": "sdks/python/src/polaris_key/core/store.py"
      },
      {
        "ns": "presentation",
        "type": "DiscoveryPresentationSource",
        "file": "sdks/python/src/polaris_key/presentation.py"
      },
      {
        "ns": "boot",
        "file": "sdks/python/src/polaris_key/boot.py"
      }
    ],
    "swift": [
      {
        "ns": "client",
        "type": "PolarisKeyClient",
        "file": "sdks/swift/Sources/PolarisKey/PolarisKeyClient.swift"
      },
      {
        "ns": "client",
        "type": "PolarisKeyClient",
        "file": "sdks/swift/Sources/PolarisKey/ClientBundle.swift"
      },
      {
        "ns": "client",
        "type": "PolarisKeyClient",
        "file": "sdks/swift/Sources/PolarisKey/Events.swift"
      },
      {
        "ns": "client",
        "type": "PolarisKeyClient",
        "file": "sdks/swift/Sources/PolarisKey/SignIn.swift"
      },
      {
        "ns": "client",
        "type": "PolarisKeyClient",
        "file": "sdks/swift/Sources/PolarisKeyUpdate/ClientUpdate.swift"
      },
      {
        "ns": "client",
        "type": "PolarisKeyClient",
        "file": "sdks/swift/Sources/PolarisKey/Boot.swift"
      },
      {
        "ns": "config",
        "type": "ConfigClient",
        "file": "sdks/swift/Sources/PolarisKeyConfig/ConfigClient.swift"
      },
      {
        "ns": "config",
        "type": "ConfigClient",
        "file": "sdks/swift/Sources/PolarisKeyConfig/ConfigSetting.swift"
      },
      {
        "ns": "config",
        "type": "ConfigSetting",
        "file": "sdks/swift/Sources/PolarisKeyConfig/ConfigSetting.swift"
      },
      {
        "ns": "license",
        "type": "LicenseClient",
        "file": "sdks/swift/Sources/PolarisKeyLicense/LicenseClient.swift"
      },
      {
        "ns": "entitlements",
        "type": "EntitlementsClient",
        "file": "sdks/swift/Sources/PolarisKeyLicense/EntitlementsClient.swift"
      },
      {
        "ns": "identity",
        "type": "IdentityClient",
        "file": "sdks/swift/Sources/PolarisKeyIdentity/IdentityClient.swift"
      },
      {
        "ns": "identity",
        "type": "IdentityClient",
        "file": "sdks/swift/Sources/PolarisKeyIdentity/SignIn.swift"
      },
      {
        "ns": "devices",
        "type": "DevicesClient",
        "file": "sdks/swift/Sources/PolarisKey/DevicesClient.swift"
      },
      {
        "ns": "release",
        "type": "ReleaseClient",
        "file": "sdks/swift/Sources/PolarisKeyRelease/ReleaseClient.swift"
      },
      {
        "ns": "update",
        "type": "UpdateClient",
        "file": "sdks/swift/Sources/PolarisKeyUpdate/UpdateClient.swift"
      },
      {
        "ns": "update",
        "type": "UpdateClient",
        "file": "sdks/swift/Sources/PolarisKeyUpdate/Install.swift"
      },
      {
        "ns": "update",
        "type": "UpdateClient",
        "file": "sdks/swift/Sources/PolarisKeyPacks/UpdatePacks.swift"
      },
      {
        "ns": "distribution",
        "type": "DistributionClient",
        "file": "sdks/swift/Sources/PolarisKey/DistributionClient.swift"
      },
      {
        "ns": "commerce",
        "type": "CommerceClient",
        "file": "sdks/swift/Sources/PolarisKey/CommerceClient.swift"
      },
      {
        "ns": "packs",
        "type": "PacksClient",
        "file": "sdks/swift/Sources/PolarisKeyPacks/PacksClient.swift"
      },
      {
        "ns": "packs",
        "type": "PacksClient",
        "file": "sdks/swift/Sources/PolarisKeyPacks/UpdateContentSource.swift"
      },
      {
        "ns": "events",
        "type": "PolarisEventHub",
        "file": "sdks/swift/Sources/PolarisKey/Events.swift"
      },
      {
        "ns": "store",
        "type": "Store",
        "file": "sdks/swift/Sources/PolarisKeyCore/Store.swift"
      },
      {
        "ns": "presentation",
        "type": "PresentationSource",
        "file": "sdks/swift/Sources/PolarisKeyCore/Presentation.swift"
      }
    ],
    "kotlin": [
      {
        "ns": "client",
        "type": "PolarisKeyClient",
        "file": "sdks/kotlin/sdk/src/main/kotlin/im/plrs/key/sdk/PolarisKeyClient.kt"
      },
      {
        "ns": "client",
        "type": "Companion",
        "file": "sdks/kotlin/sdk/src/main/kotlin/im/plrs/key/sdk/PolarisKeyClient.kt"
      },
      {
        "ns": "client",
        "file": "sdks/kotlin/sdk/src/main/kotlin/im/plrs/key/sdk/Boot.kt"
      },
      {
        "ns": "client",
        "type": "PolarisKeyAndroid",